Prefix,Source_Name,Base_URI,License,Home_URL
LOINC,Logical Observation Identifiers Names and Codes,https://loinc.org/,LOINC License (Registration Required),https://loinc.org/
ELSST,European Language Social Science Thesaurus,https://elsst.cessda.eu/id/6/,CC BY 4.0,https://elsst.cessda.eu/
HL7v3,HL7 v3 Religious Affiliation,http://terminology.hl7.org/CodeSystem/v3-ReligiousAffiliation,HL7 Terminology License,https://terminology.hl7.org/
HL7v2,HL7 v2 Religion,http://terminology.hl7.org/CodeSystem/v2-0006,HL7 Terminology License,https://terminology.hl7.org/
LCDGT,LC Demographic Group Terms,http://id.loc.gov/authorities/demographicTerms/,Public Domain,https://id.loc.gov/authorities/demographicTerms.html
SNOMED,SNOMED CT,http://snomed.info/id/,SNOMED Affiliate License (Registration Required),https://www.snomed.org/
LCSH,Library of Congress Subject Headings,http://id.loc.gov/authorities/subjects/,Public Domain,https://id.loc.gov/authorities/subjects.html
AAT,Getty Art & Architecture Thesaurus,http://vocab.getty.edu/aat/,ODC-BY 1.0,https://www.getty.edu/research/tools/vocabularies/aat/
TGM,Thesaurus for Graphic Materials,http://id.loc.gov/vocabulary/graphicMaterials/,Public Domain,https://www.loc.gov/pictures/collection/tgm/
AFSET,LC Ethnographic Terms,http://id.loc.gov/vocabulary/ethnographicTerms/,Public Domain,https://id.loc.gov/vocabulary/ethnographicTerms.html
MeSH,Medical Subject Headings,http://id.nlm.nih.gov/mesh/,Public Domain,https://www.nlm.nih.gov/mesh/meshhome.html